index,comments,time
9955,有被震撼到,29天前发布
9956,平凡而又伟大,29天前发布
9957,平凡中活出的伟大,29天前发布
9958,他公平！,29天前发布
9959,生在一个过于浮躁的年代，有时常常扪心自问所谓的胜利是什么？或许对于现代的很多人来说，胜利就是所谓的比谁拥有的钱多，或许这样看来二舅并不是一个胜利的人。看了这11分钟的短片，看到姥姥和二舅的时候，眼泪不自觉的流下来了。是因为想到那则将自己的母亲关在猪圈里的新闻，何其可悲！因此我作为一个00后，非常真心地佩服新中国成立，爷爷奶奶那一辈的人。他们的真心，真诚，他们的努力很多就是不求回报的，因为在他们看来，自己看似不起眼的付出真的可以为新中国的未来有所奉献！最后，致敬二舅！人生如戏，每个人都是平凡而伟大的。,29天前发布
9960,快乐也是一天，不快乐也是一天＠_＠,29天前发布
9961,我爸他初二辍学养家，家里穷，供不起他上学，才十多岁就扛起家里的顶梁柱，一直扛到现在还没放下……,29天前发布
9962,我爷爷像极了这位“二舅”，也是这样聪明一个人，也是木匠，可惜生不逢时，我没有见过他，因为他在我出生的前一个月去世了。,29天前发布
9963,平凡、伟大,29天前发布
9964,文案真的那么好？ 无非炒作罢了，起码感动不了我,29天前发布
9965,求一个文字版，谁有,29天前发布
9966,"6688，简直酷得要死！
太喜欢up的文案了。。。",29天前发布
9967,好像穷了一辈子都会觉得不公平，要是我富一辈子，那就是公平吧_(:з」∠)_,29天前发布
9968,二舅真是平凡又伟大的人[支持],29天前发布
9969,洗白的视频，给谁洗的呢？答案自在人心。坏的说成好的，差的说成优的，还不知错，还到处洗，倒行逆施。得道多助，失道寡助。天必亡之。,29天前发布
9970,致敬二舅，致敬所有平凡且伟大的，在生活的泥沼中沉浮却不沉沦的普通人。,29天前发布
9971,我仿佛看到了未来的学生为了阅读理解而挠头的样子。,29天前发布
9972,8.8万人同时观看！[热][热],29天前发布
9973,多么幸运，我们认识二舅了，二舅已经名扬天下了！,29天前发布
9974,仁者见仁，智者见智。我看到的是与命运搏斗的勇士，而不是苦难。作者真正想传达的是对苦难的歌颂？？？,29天前发布
9975,敬二舅,29天前发布
9976,这样的人 最可贵的是他的内核 不拘泥于肉体凡胎  是在用灵魂指引他的人生 不管处在何种境遇里 他都会过得很好 最后二舅的本子那里 看到了很多那个年代纯质又热烈的人 就像那个年代的精神又回来了 多少给现生注入了不少活力 两个时代重逢了,29天前发布
9977,感谢祖国的强大和互联网，才能让我们看到这么有故事的一个人！,29天前发布
9978,谢谢，只想说谢谢你,29天前发布
9979,最后这一回头，让我想起了宰相刘罗锅,29天前发布
9980,敬二舅,29天前发布
9981,这是人间的事，这是属于二舅的精彩人生。,29天前发布
9982,@Ciel123000,29天前发布
9983,敬二舅,29天前发布
9984,二舅值得钦佩，但我希望在坐的各位包括我，永远不要成为二舅。我如果有一天我的生活状态真的落到二舅这个状况，我会找一根绳子[微笑],29天前发布
9985,当代鲁迅,29天前发布
9986,谢谢二舅,29天前发布
9987,真是在众多视频中让人感觉眼前一亮。,29天前发布
9988,文稿很棒，纵使短视频当道，也不可忽略文字给人心灵带来的震撼和感触。第一次看到文字性这么好的视频作品，好的作品应该是能给人带来思考的，同时又反应了时代特点和人物性格。加之人与人之间的联系，亲情、爱情。简单的文字却几度让人落泪，看的时候就频频想到余华老师的《活着》，苦难中的平凡尤为不易。,29天前发布
9989,生逢当世，不失为一种幸运。,29天前发布
9990,看着别人的人生，却不知道自己该如何过好一生,29天前发布
9991,平凡的，出众的,29天前发布
9992,“你看，二舅总有办法”,29天前发布
9993,医疗水平决定人的命运啊,29天前发布
9994,不能用什么轰轰烈烈去描述，却独有属于二舅的生活真谛，其实生活本该如此，没有那么多如果，只有随遇而安。,29天前发布
9995,"很幸运刷了这样一个视频，他在我迷茫的时候拉了我一把。这一年真的好难，难的我曾经想寻求解脱。我不知道是不是所有人把编制看的都那么重要，但是于我而言好像似的，有的时候我在想我考编制是为了我自己还是为了我的父母。
其实我知道，每个工作都很辛苦，从来没有轻松的事情，。但是你的负情绪他总会到达一个顶峰，他会让你崩溃，会让你失去所有欲望，而你在挣扎，挣扎。",29天前发布
9996,"光谈二舅苦难下的乐观，为什么不深究苦难的源头？
“歌颂苦难和苦难下人的坚强，是没有意义的，有时候甚至是滑稽的”",29天前发布
9997,我太喜欢你的叙述了，关注了,29天前发布
9998,这视频太厉害了，只能说UP主的文案绝顶,29天前发布
9999,这视频太厉害了，只能说UP主的文案绝顶,29天前发布
10000,真正的勇士向来默默无闻，喧哗不止的永远是自视高贵的一群。,29天前发布
10001,敬二舅,29天前发布
10002,BV1Ca411K7Gh作者在无意识中表达的东西往往是可怕的,29天前发布
10003,所以为啥你还会精神内耗[微笑],29天前发布
10004,我只能说我身边也有这样的人而且比这个二舅更加有能力,29天前发布
10005,二舅之所以能成为二舅，因为第一他智商高，第二他侄子智商高。二舅的经历让我更信的是基因决定论。,29天前发布
10006,好厉害,29天前发布
10007,纪录片：记录和映照了每个二舅的平凡而不凡的生活。,29天前发布
10008,祝福二舅一直开开心心[拥抱][拥抱][拥抱],29天前发布
10009,好,29天前发布
10010,二舅当年如果没有发烧该有多好,29天前发布
10011,文案写的是真的好啊！有读朱自清的感觉。二舅是一个平凡而伟大的人，敬二舅。确实，第二快乐的人是从不往回头看的人,29天前发布
10012,给二舅一点流量变现加点养老钱有啥不好啊,29天前发布
10013,已泪崩,29天前发布
10014,为文案和其中一些精妙的编排3连了，但是鸡汤还是鸡汤，虽然看起来是避免歌颂苦难，但实质不变。,29天前发布
10015,我父亲当年也很像，他高中升学考上了县一中可是被他当时班主任找人顶替了名额，后来十七岁郁郁不得志，最后没办法，爷爷家里不富裕，没法支持他复读，后来也是去学的木匠，手艺在我们家那块也是很好的，可惜世事无常，去年出了车祸，甚至没等到我娶妻生子，我对此耿耿于怀了很久，看到视频里的那句人生最大的遗憾就是一直在遗憾过去的遗憾，我觉得有所释怀，人生还得继续向前看…,29天前发布
10016,泪目了,29天前发布
10017,文案真的的不错,29天前发布
10018,谢谢二舅，也谢谢up主，让我彻底打开了多年的心结，也向那些经历苦难但是依旧活的精彩的朴实的人们致敬,29天前发布
10019,平凡却伟大,29天前发布
10020,每看一遍都有不同的感想，二舅，愿您天天开心,29天前发布
10021,苦是真的苦，认命是真的认命，把视频拍的这么美好，意义何在,29天前发布
10022,人生最大的遗憾莫过于一直遗憾过去的遗憾,29天前发布
10023,生活的真相往往是令人无奈的，这些无奈会造成让人感到遗憾抑或后悔的结果，但二舅能在明白了这种的情况下依旧保持着对生活的热爱，那就是真的像个英雄一样厉害啊！,29天前发布
10024,成人版的山里小孩连饭都吃不饱，你还有什么好抱怨的,29天前发布
10025,我理应…？,29天前发布
10026,我要这币有何用？,29天前发布
10027,我身无拘,29天前发布
10028,[热词系列_三连],29天前发布
10029,二舅这种奇才，现在已经名扬天下了,29天前发布
10030,二舅从未反抗,29天前发布
10031,二舅活得就是本分，up之所以有敬意，就是发现了这社会丢掉的东西～本分。,29天前发布
10032,“谁说对弈平凡的不算英雄”，我觉得二舅就是对弈平凡的英雄~！,29天前发布
10033,[点赞][点赞],29天前发布
10034,说不出什么牛的话 看完很震撼 很牛,29天前发布
10035,不应该因为社会问题而忽视了可贵的品质，也不应该赞扬品质而回避社会问题。,29天前发布
10036,但是我们都更向往也更需要世俗的胜利与成功,29天前发布
10037,你是一个,29天前发布
10038,其实就在看到视频前，我也深处精神内耗之中，而看后当晚便有了动力，只想留言表示感谢，祝一切都好,29天前发布
10039,谁说站在光里的才算英雄？,29天前发布
10040,口音，房子感觉就在河北石家庄附近,29天前发布
10041,也治好了我的精神内耗，可以拍成电影,29天前发布
10042,"下定决心,不怕牺牲,排除万难,去争取胜利。",29天前发布
10043,虽然鸡汤很好喝，但我还是想问问鸡肉哪去了？,29天前发布
10044,我说这口音格外熟悉 原来是我高中听网课的历史老师！真的好爱你！,29天前发布
10045,文字给人带来的震撼真的很大,29天前发布
10046,"敬二舅，平凡的人生，不平凡的伟大！
UP主的文案真的可以算一篇优秀的现代散文，第一次在B站投币[喜极而泣]",29天前发布
10047,平凡而又伟大,29天前发布
10048,高高在上那味儿冲得,29天前发布
10049,"也许生活中每个人都认识个二舅类的人物：命途多舛，却从不自怨自艾；接受了自己的遗憾与不幸，却又在苦难的生活中挣扎着、努力着、奋力跳出人生的井。
生活报我以伤痛，我报之以歌。",29天前发布
10050,河北儿女自古思考问题深邃至理默默无闻,29天前发布
10051,二舅的字写的真好，字如其人,29天前发布
10052,"‘’纵使疾风起,人生不言弃,往事不回头,余生不将就‘’[锦鲤]",29天前发布
10053,能理解为啥媒体都在说这个视频，这么好的视频不让所有人看看可惜了，看完了想想比我可怜的人这么多我996007又算什么呢，埋着头继续干别抱怨咯，当然要好好宣传，视频不是规训视频，效果堪比规训,29天前发布
10054,路转粉,29天前发布
10055,呜呜呜看哭了,29天前发布
10056,向下扎根，向上绽放,29天前发布
10057,"刚开始觉得是一个平平无奇的片子
而且尊唐（从这里认识）的声音真的很像电影解说（之前刷电影简要记录的声音）
秉着“看看吧！”的念头
二舅为什么能登上热搜?
于是我看一下去
二舅，他值得！！！[星星眼]",29天前发布
10058,敬二舅,29天前发布
10059,厉害,29天前发布
10060,@沈梓安吖 你看，大气牛掰！,29天前发布
10061,说的真好……老病就是生死之间的试炼……不然从生到死该有多留恋多不舍……,29天前发布
10062,建议申请语文教材课文,29天前发布
10063,“第二快乐的人不会回头看”。所以不要再被后悔和无意义的“假如”绑架了。,29天前发布
10064,最好的教育不是言传而是身教，小孩并不瞎。,29天前发布
10065,这应该就是《平凡的世界》的精髓吧,29天前发布
10066,我说在我的想象中，有一双滑板鞋~,29天前发布
10067,天才二舅,29天前发布
10068,二舅的人生很精彩，up主的文案也很精彩。,29天前发布
10069,作文素材 +1,29天前发布
10070,老舍当年写下《骆驼祥子》是希望以后世上再无骆驼祥子，而不是希望人人变成骆驼祥子。,29天前发布
10071,看不到正能量，只看到各种悲凉；希望看到正能量的你，你的未来也能这么正能量；希望看到悲凉的你，远离视频的出现的各种悲凉,29天前发布
10072,"他以为只能顾好自己，最终却顾好了宁宁，顾好了八旬的母亲，顾好了一个村庄，甚至顾了来自五湖四海的、“精神内耗”的你我。  看具体的风景，做具体的事，爱具体的人。
转自微博",29天前发布
10073,衣戈彻底的火了！,29天前发布
10074,[大哭][打call],29天前发布
10075,他真的活出了自己的人生！,29天前发布
10076,真的，其实我们可以多走进平凡的乡村看一看，每次回到老家，沉静祥和充满生活的希望与力量的烟火气，总是能让人对这个世界通透。,29天前发布
10077,你,29天前发布
10078,在另一个世界里的二舅一定过着很好的的生活,29天前发布
10079,在另一个世界里的二舅一定过着很好的的生活,29天前发布
10080,敬二舅,29天前发布
10081,视频版《活着》，昨天看完，结尾令人动容。我不想说感动，看他的人生，你就知道这个词有了从未有过的居高临下。,29天前发布
10082,有人看苦难，有人看强悍，不用互相找理解哈,29天前发布
10083,没想到2022年了还能看到有视频博主提到树先生,29天前发布
10084,哇[大哭],29天前发布
10085,7月27日15:38还有8.7w人在看，其实每一个爷爷奶奶都有传奇的故事，曾经的我也会在星夜看着星空，问当年爷爷奶奶的故事，但是现在的我们，为生活忙碌着，似乎少了很多交流了。。,29天前发布
10086,[妙啊],29天前发布
10087,难道是让我们这些已经背负了很大压力的年轻人学学二舅，保持乐观，觉得自己还没那么惨，让我们千万别躺平？,29天前发布
10088,真的看哭了，哪有这么多遗憾，不过是对过去自己的怨怼罢了。排除万难坚定不移！,29天前发布
10089,@Delilah张张子,29天前发布
10090,"好喜欢视频中的一句话
第一快乐的人是不需要对别人负责的人，第二快乐的人是从不回头看的人。
确确实实是这样子",29天前发布
10091,要么活成树先生，要么活成二舅吧[抱拳],29天前发布
10092,昨天900万播放今天就2000多万了,29天前发布
10093,up主，抖音哪个账号是你的，感觉都是冒充的感觉,29天前发布
10094,“生活就像是巧克力，你永远不知道下一块是什么味道”,29天前发布
10095,太感动了，感觉得反复看。,29天前发布
10096,不行我得睡会，要不然心中的淤泥会压的我喘不过气。,29天前发布
10097,虽然不知道为什么这个视频这么火，但翻了一下之前的视频，感觉也都很喜欢，于是关注了,29天前发布
10098,致敬二舅，学习二舅的精神,29天前发布
10099,好的作品太少了，但好的作品没有人会吝啬自己的赞赏，看看这涨粉速度，播放量，增长速度,29天前发布
10100,敬二舅,29天前发布
10101,敬二舅,29天前发布
10102,必进入站必刷视频！！应该让更多人看见,29天前发布
10103,有人说二舅是平凡的，我觉得一点也不平凡，我认为有不少人初中不会考全校第一，木工活看三天也学不会??,29天前发布
10104,上天都在嫉妒二舅,29天前发布
10105,看不下去,29天前发布
10106,当代《活着》,29天前发布
10107,二舅的故事与力量，是专囿于个人的。这种力量值得尊敬，但毕竟是个体的，也就是有概率的。但他和他的故事能存在，得说我们七十多年的历史也是“庄敬”的，尽管历史背面斑驳错杂。个人视角可以汲取力量，“干了这碗鸡汤，干翻这个世界”，历史视角可以抚慰伤疤，与历史和解。,29天前发布
10108,大家的精神内耗好一些了吗,29天前发布
10109,我上一次看到有视频中文案这种感觉的文章叫《活着》,29天前发布
10110,"读完了二舅，内心久久不能平静。似乎有什么感受的时候，身后的兄弟问了句：”你咋不打游戏了？“
steam，启动！",29天前发布
10111,天才也抵不过平凡的岁月流逝,29天前发布
10112,觉得遗憾的只是我们，二舅可是第二快乐的人啊,29天前发布
10113,二舅歪曲的身体，却用眼睛俯视看这个世界。,29天前发布
10114,一个幸运的人对一个不幸者的愧怍。,29天前发布
10115,每个人的一生都是不平凡的，都是伟大的一生。,29天前发布
10116,这算是 寻根文学吗？,29天前发布
10117,昨天还700万播放呢 [哦呼],29天前发布
10118,有点消费二舅了,29天前发布
10119,这个世界上第一快乐的人，是不需要对别人负责的人。第二快乐的人，就是从不回头看的人。,29天前发布
10120,就这样又过了三十年 乏善可陈 是的 普通人的生活就是这样,29天前发布
10121,好快的涨粉,29天前发布
10122,结尾的音乐真的太燃了，对抗命运的力量，和坚定的信念！,29天前发布
10123,二舅绝顶聪明，要是上学成就不可限量,29天前发布
10124,二舅代表了一个时代 一个艰苦的时代一个踏实肯干的时代 正是这个时代这样的人给了我们这一代逐梦的权利 感谢二舅们 也希望我们这一代不要摒弃这种踏实肯干的精神,29天前发布
10125,他公平,29天前发布
10126,加油加油．,29天前发布
10127,"转:这是可以进课本的文章，他发在了这里。
这里不是课本，但写满了各式人生。这里的色彩很好。",29天前发布
10128,"其实看完之后 你会发现童年或者小时候有很多
像“二舅”这样的人 回想一下 当时还不理解他们的行为和做事风格 现在自己长大了 看看自己反而迷茫了 原来不理解的事情 或许就在自己身上发生着......",29天前发布
10129,8.9万正在看。。。,29天前发布
10130,，，，大概是发烧用的安乃近打多了？,29天前发布
10131,怎么，怎么，怎么三天不到就爆火了？,29天前发布
10132,二舅就是这个村子的神,29天前发布
10133,"人生海海，山山而川，不过尔尔。

看见具体的风景，做具体的事，爱具体的人。",29天前发布
10134,看哭了,29天前发布
10135,想起了我的舅舅一样,29天前发布
10136,希望普通人不要去讴歌别人的苦难，不要靠别人的苦难自我感动,29天前发布
10137,无论是二舅自己靠生活谱写的人生，还是up文案下的二舅的人生都像极了一篇普通人写下的不普通的诗篇,29天前发布
10138,致敬,29天前发布
10139,二舅花费三天学会了木工，我费三天只能学会电摇[doge][微笑],29天前发布
10140,好感动,29天前发布
10141,哀而不伤。,29天前发布
10142,二舅太酷了,29天前发布
10143,镇站之宝,29天前发布
10144,虽然才二十几岁 却经常为了口中的所谓的遗憾耿耿于怀 看了二舅的视频 以后我也要做一个第二快乐的人 不沉沦 不回头 不留恋 向前看,29天前发布
10145,文案写的挺好，要是发表在《意林》《读者》又是一篇大火的文章,29天前发布
10146,人们总容易抱怨时机不对，总悔恨自己的选择有误，总遗憾自己不够幸运，总质问上天的不公。风可以吹走一张纸，但吹不走一只蝴蝶，生命的力量在于不服从，以自己的力量，去拼自己的胜利！,29天前发布
10147,他二舅说，你们这些长篇大论的人都在精神内耗。,29天前发布
10148,庸医害人呀[来古-注意],29天前发布
10149,他公平,29天前发布
10150,三连支持，非常棒[打call],29天前发布
10151,他公平,29天前发布
10152,“虽然在世俗上，二舅一事无成。但在我看来，二舅是人中龙凤”还是觉得遗憾和可惜,29天前发布
10153,我见过播放量长得最快的视频,29天前发布
10154,真的爆火了   之前看才100多万播放量 今天一看2000多了,29天前发布
10155,致敬人生,29天前发布
10156,那就简单说声好吧，我们的生活,29天前发布
10157,平凡且可贵,29天前发布
10158,愿，鳏寡孤独废疾者，皆有所养。,29天前发布
10159,愿，鳏寡孤独废疾者，皆有所养。,29天前发布
10160,把命运的无奈说的如此清新脱俗,29天前发布
10161,[tv_点赞],29天前发布
10162,在这个视频下面的热评没人去指责庸医，没人去想88岁的老母亲为什么数次想要上吊,29天前发布
10163,冷峻的幽默，却又透露出感人质朴感人的生活细节，夹杂着时代历史的深邃感，给人以欢笑，给人以感动，浓缩这中国万万个平凡而又伟大的劳动人民，体现着浓厚的中国精神，穿梭过其一生不过廖廖几笔，却又质朴温暖。冲淡了现代浮躁的车水马龙，采菊东篱下，悠然见南山，文笔简练却又不乏生活哲理，实为佳作。致我们身边的每一个二舅致我们身边每一个平凡而又不平凡的人。[抱拳],29天前发布
10164,“世界上只有一种英雄主义，那就是认识了生活的残酷以后仍然热爱生活”,29天前发布
10165,二舅也太厉害了吧,29天前发布
10166,苦难从来不值得歌颂,29天前发布
10167,王家卫..,29天前发布
10168,这是一部剪短却又丰富的人生，人生百态，却异常精彩！,29天前发布
10169,平凡的人最可贵,29天前发布
10170,想到我的外公和奶奶 哭的稀里哗啦,29天前发布
10171,哎呀我说命运呀,29天前发布
10172,[捂眼]我这个没文化的想问一问，什么叫树先生？[思考],29天前发布
10173,"视频不长，却掷地有声。作为农村出来的小孩，我想说，二舅是太多农村普通人的缩影，他们根本不知道什么是焦虑，什么是内卷，他们所做的，不过是拼了命地活下来。 默默无闻，坚韧不拔，生活简陋却又比谁都精神富足，他们是无垠夜空中为自己闪亮的星星。Life consists not in holding good cards, but in playing well those you hold.",29天前发布
10174,不如读者[吃瓜],29天前发布
10175,二舅什么时候开直播？,29天前发布
10176,昨天播放还是七百多万,29天前发布
10177,像看了一篇阅读理解,29天前发布
10178,二舅是老一辈人的缩影,29天前发布
10179,庸医才是一切的开头,29天前发布
10180,平凡 朴实 又可爱的中国式老舅,29天前发布
10181,人活一种内心的满足，我羡慕和佩服能放下的人,29天前发布
10182,下定决心 不怕牺牲 排除万难 去争取胜利,29天前发布
10183,&#34;下定决心，不怕牺牲，排除万难，去争取胜利&#34;,29天前发布
10184,快手抖音混热度 知乎B站的观点几乎对立 都是对的 都是这个世界,29天前发布
10185,伟大的平凡,29天前发布
10186,我二舅介绍的,29天前发布
10187,这是赞颂苦难吗？这是陈述事实啊!也许在某些人眼里说啥都是歌颂苦难吧,29天前发布
10188,我哭了。,29天前发布
10189,一鸣惊人,29天前发布
10190,BV1Ca411K7Gh,29天前发布
10191,一键三连,29天前发布
10192,卧槽，几万的时候刷到的，现在两千万了[点赞][点赞][点赞],29天前发布
10193,"如果这条视频能够一直保存下去的话，未来有一天也一定会再火一次吧……
只希望那天永远不要到来……",29天前发布
10194,螀麇百折赵子寒 涕落衣襟悗拭惉,29天前发布
10195,无比感动！跟不幸的人相比，我还是拥有的太多了！珍惜每时每刻，继续努力去争取去奋斗去回馈,29天前发布
10196,坚强的灵魂,29天前发布
10197,请求浩哥，拍成电影吧,29天前发布
10198,@剩一杯茶 好好看 真的充满了智慧 不过你应该看过了吧[原神_哼],29天前发布
10199,@Keep-YYY 致敬二舅,29天前发布
10200,生活就是直面困难，不断往前呀[打call],29天前发布
10201,他公平,29天前发布
10202,"《吾之井底蛙语》
网传“二舅”奇杰也。亦观其一二三载卧病在床，而墮气。后醒而耕于木，忠于本，是为玄德，不负其奇才之杰。
接上次浅谈其“恕”
对己终身行之，即子曰：其恕乎！己所不欲，勿施于人。
对于内耗：恕己

",29天前发布
10203,看了这个视频，我的第一反应是这种简直就是超然物外的天人啊，如此的不争和平和。可后来我忽然意识到其实就在我们的爷爷辈，甚至父母辈，他们也存在着很多这样精彩的但是没有记录下来的故事，他们也是在穷其一生在演好他们的剧本。遗憾得是我从来没有那么面对面静下心来听他们述说并做好记录。爷爷奶奶已经80岁了，我不想让他们的故事就这样随风溜走。,29天前发布
10204,看了看文案热血沸腾，看了看房价又躺回去了,29天前发布
10205,这条视频的创作者注定会被舆论包围。关于苦难的讲述，好像总没有个合适的方式。,29天前发布
10206,拥有一个手艺的重要性,29天前发布
10207,真的不知道说些什么，眼泪就这样不停地流,29天前发布
10208,"永远不要相信苦难是值得的
苦难就是苦难
苦难不会带来成功
苦难不值得追求
磨练意志是因为苦难无法躲开",29天前发布
10209,二舅很坚强，也很努力，很善良。,29天前发布
