index,comments,time
23185,必须扎根土壤，才有向上的力量，我的勇气来源于和我有相同生活的人，就像二舅那样，距离或许遥远，但情感非常亲切,29天前发布
23186,看了这个视频文学，第一次给了真正意义上的一键三连。[给心心]敬二舅[打call][给心心],29天前发布
23187,勇气！,29天前发布
23188,"被针头改写的命运。他却坚强的活出了自我。
我小时候村里打防疫针，混用针头导致感染了乙肝，现在时常活在恐惧中，这是造成我精神内耗的重要原因。",29天前发布
23189,敬二舅，敬每一个无悔向前的人。,29天前发布
23190,谢谢你 有被治愈到 人快死的时候才发现遗憾是一直在遗憾之前遗憾的事情,29天前发布
23191,生乃一条无尽危路，唯有死在尽头驻足,29天前发布
23192,我又为何不把这一般苦难的人生过得充实而有意义呢，不怀遗憾，做好规划，脚踏实地，在老病来临前充实这段人生旅途就是我自己的胜利啦，敬二舅！,29天前发布
23193,"人生最大的遗憾就是一直在遗憾过去的遗憾
所以 没什么好遗憾的
是属于我们的独一无二的人生",29天前发布
23194,@Linda9968super,29天前发布
23195,人生从来不是一副好牌，而是如何把一副烂牌打得精彩[大哭],29天前发布
23196,看得我热泪盈眶[保卫萝卜_哭哭],29天前发布
23197,太牛了 文案 bgm 以及二舅 都太牛了,29天前发布
23198,@子欠台,29天前发布
23199,@子欠台,29天前发布
23200,自强不息！,29天前发布
23201,太牛了,29天前发布
23202,太治愈了,29天前发布
23203,上一个那么会说话得诺贝尔奖了。,29天前发布
23204,二舅的故事像一部非虚构的文学作品，谢谢作者和二舅为我们带来这样的故事。[爱心],29天前发布
23205,人都是往往快死的时候才发现人生最大的遗憾就是一直在遗憾过去的遗憾。,29天前发布
23206,天行健，君子以自强不息。,29天前发布
23207,看得我泪眼婆娑，二舅是一个坚韧的人,29天前发布
23208,哇塞,29天前发布
23209,"第一句：世界上第一快乐的人是不用对别人负责的人，第二快乐的人是从不往后看的人。
第二句：我们理应让自己的人生走得充实丰满。",29天前发布
23210,希望不要被“网红”们打扰[热],29天前发布
23211,时常抱怨这个那个的我，默默地看完这个视频…比起自怨自艾，这位先生的强大让人佩服！也不是非常完美的英雄，也不是最后逆袭的人物，但生活中时刻展现的自立，自强，活得通透，活得潇洒！,29天前发布
23212,我发现我不知道用何种话语对这部影片进行表达，也许是我真的意识到，我在丢失一些东西，谢谢二舅，也谢谢作者。,29天前发布
23213,每一个乡野里都有很多这样的故事。发生在他们身上的故事真的很有韵味且让我敬佩，那个年代生不逢时的他们有太多遗憾，遇到太多我无法想象的困难，但依然充满顽强的生命力。,29天前发布
23214,我愿称之为年度最佳视频,29天前发布
23215,哥，我们这河北共青团还发了个公众号专门说你这个视频,29天前发布
23216,所以，好的文案，恰当的剪辑，合适的bgm，让二舅成为了一个活生生的代表，无论城市乡村，那个年代所坚持的梦啊，平凡且朴实,29天前发布
23217,人生最大的遗憾是一直遗憾过去的遗憾，确实，如此这般便会陷入情绪的怪圈。,29天前发布
23218,@刘二婉吹泡泡,29天前发布
23219,看了11分20秒都觉得没啥的，最后几秒突然蚌埠住[支持]大家都要认真生活啊！！,29天前发布
23220,遗憾是让人沉沦的毒药??,29天前发布
23221,平凡既是伟大,29天前发布
23222,遗憾在电影里是主角崛起的前戏，在生活里是让人沉沦的毒药。,29天前发布
23223,二舅要不要试试写app？,29天前发布
23224,因为他‘公平’,29天前发布
23225,有点像保尔柯察金的感觉,29天前发布
23226,一杯敬生活，一杯敬二舅[大哭],29天前发布
23227,对生老病死有了新的理解，总以为老病最是无情 它让亲历者无能为力让身边人束手无策。我问妈妈姥姥走了之后你在想什么？“没能早早尽孝”“现在想开了，看着你姥姥被癌症折磨，我们再怎么不舍也不愿让她这么痛苦”。在外地上学，姥姥临走前的画面都是家人拼凑给我的，我不敢想象姥姥24h清醒的被病痛折磨。老病这个过程渐渐剥离处在痛苦之中的人活下去的勇气，也逐渐断了亲人期望他们活下去的欲望。[大哭]哎呀 时间为啥不能倒流呀,29天前发布
23228,为什么火了？？？？？,29天前发布
23229,人生往往就是如此吊诡，可能是极偶然的一件事，就影响到了之后人生的走向。现代人，遇到一点不公一点磨难就选择摆烂、躺平；可是在某个山村，某个城市的角落，却有这样一群人，哪怕他们已经历千疮百孔，却仍然在热情地活着。也许改变不了什么，也许争取不到胜利，但永远奋斗、永远充满热爱、内心充盈地活着就已经是胜利，他们是罗曼罗兰笔下真正的英雄主义者。,29天前发布
23230,11分钟的视频时间，涨了一万粉,29天前发布
23231,要不是当年的那几针，也许现在二舅的生活能不知道有多风光，但现在能时时刻刻被人需要着，又何尝不是一种幸福。,29天前发布
23232,“被仰望与被遗忘的，他们的人生”,29天前发布
23233,刚发评论就被淹没了[tv_笑哭],29天前发布
23234,入站必刷[OK],29天前发布
23235,看了好几遍,29天前发布
23236,又有力气看书了,29天前发布
23237,二舅无疑是值得佩服，豁达而坚韧的，也很感谢up向我们呈现二舅的形象。不过我始终觉得即便是这样的形象也治不好如今年轻人的精神内耗，每个时代的背景不同，每个形象的性格也不同。没有二舅这样的心境无论是在哪个时代都无法豁达，但二舅无论在哪个时代都能活的明白。,29天前发布
23238,三连了,29天前发布
23239,三连了,29天前发布
23240,写得很好,29天前发布
23241,世界最怕“认真”二字,29天前发布
23242,“第一快乐的人，是不用对别人负责的人，第二快乐的人，就是从不回头看的人。”看完视频 平实的文字 有种时代裹挟下的淡淡悲哀 却也令人自省 也是真的佩服视频里的二舅,29天前发布
23243,生活多样多变，也许出身手握一副好牌，中途可能变烂，也有可能出生一副烂牌，运气来了，它变好了。这些我们都无法掌握，但是学会和解，永远向前，起码能活的开心。希望我能永远向前。,29天前发布
23244,这世界有那么多人，但世界他不声不响。,29天前发布
23245,你看他总有办法，md现在这点算什么呢。。,29天前发布
23246,虽是平平淡淡的叙事，但是看着看着就哭了,29天前发布
23247,可惜没有亲舅舅，感受不到舅舅的爱[tv_大哭],29天前发布
23248,所以最后说的“胜利”是指什么呢？[doge],29天前发布
23249,平凡，平庸却不凡。,29天前发布
23250,人因平凡而不平凡，故事因不平凡而平凡。,29天前发布
23251,想起来阎连科先生的《我与父辈》[大哭][大哭],29天前发布
23252,真的很感动且震撼,29天前发布
23253,二舅是一个勤劳有爱且热爱学习的人,29天前发布
23254,@小泉玲奈奈奈 ！！！,29天前发布
23255,从一开始的poping就让我想起来了我的姥姥，被帕金森折磨多年，在一个夏天的早上离开了我们。姥姥一生都很可怜，小小的年纪就没了父母，带着年幼的弟弟长大，好不容易儿女出息了，却又早早的离开了。可惜我没有那么好的文笔，记录不下来姥姥的故事，希望姥姥来生不要那么苦，有一个幸福的人生??,29天前发布
23256,普通人 不普通,29天前发布
23257,如果拍成电影，拍的好绝对不亚于《阿甘正传》那个级别，太震撼了,29天前发布
23258,二舅是个天才少年[大哭],29天前发布
23259,应该多投两个币才能对得起这个视频,29天前发布
23260,这个文案感觉是在课本上出来的一样。,29天前发布
23261,真的很棒。文案看完真的，忍不住想去分析呜呜呜呜呜[大哭][大哭][大哭][大哭][大哭],29天前发布
23262,14w＋同时在线就离谱。,29天前发布
23263,14万分之一,29天前发布
23264,不怕困难，迎难而上，向前走，不回头就不会有遗憾！[大哭][大哭][大哭],29天前发布
23265,何以解忧，唯有热爱。,29天前发布
23266,世界上第二快乐的人是从不回头看的人，遗憾谁没有呢，与过去和解吧,29天前发布
23267,@导演小策,29天前发布
23268,又火一次,29天前发布
23269,"麻了，哪来的大文豪
三连了三连了[热词系列_三连]",29天前发布
23270,盲猜马前卒肯定会蹭一期[doge],29天前发布
23271,说的真好,29天前发布
23272,二舅没有消沉，反而学到了更多技能，虽然在我们看来可能是一种缺失和遗憾，但这未尝不是成就了二舅的人生的关键所在。我个人感觉有一点像高考一样（你杠就是你对）,29天前发布
23273,平凡中铸就伟大。,29天前发布
23274,这个6688组合简直酷得要死,29天前发布
23275,看完竟发现这才只是十一分钟的视频[微笑],29天前发布
23276,想起我的外公,29天前发布
23277,害怕这个文案出现在阅读理解上[嗑瓜子],29天前发布
23278,从始至终的感动，让我舍不得快进，忍不住翻看,29天前发布
23279,@Nadezhdarr,29天前发布
23280,听着听着听哭了，唉,29天前发布
23281,[爱心][爱心][爱心],29天前发布
23282,太可惜了,29天前发布
23283,"二舅战胜了命运的扭曲，以智慧和勤劳养活自己，并一直努力爱着家人朋友。他活得如此温柔敦厚，仿佛一本封面残损，但图文并茂、意蕴动人的书。
愿我也可以摆脱遗憾、焦虑和恐惧，活出自己的爱与奉献。",29天前发布
23284,啊吧啊吧,29天前发布
23285,很令人感动,29天前发布
23286,散文[热词系列_吹爆],29天前发布
23287,绝了绝了绝了[大哭][大哭][大哭],29天前发布
23288,平凡而又真实。,29天前发布
23289,很受感动！,29天前发布
23290,昨天第一次看，没什么感觉。今天和家人喝了点酒，又偶然看了第二遍，感触颇深，我在想这两遍为什么差别会这么大呢，想了想才知道，原来我们已经有了厚厚的一次精神隔膜，只有酒精才能打开。,29天前发布
23291,淡淡的忧伤,29天前发布
23292,看了三遍，真的很感动,29天前发布
23293,6688真的感动到我了。二舅自然有办法，是对生活的不妥协。,29天前发布
23294,这tm才是中国的超级英雄[大哭][大哭][大哭][大哭][大哭],29天前发布
23295,哭了,29天前发布
23296,"最喜欢的几句：
这可不是上天的不仁，而是怜悯。不然我们每个人都在七八十岁，却还康健力壮之年去世，那对这个世界该有多么的留恋呢?
可见让小孩将来孝顺自己的最好方法，就是默默地孝顺自己的父母。小孩是小，不是瞎。
他这种奇才啊，只不过是生不逢时。他应该受国家的栽培，名扬天下才对不应该弄到这么落魄可怜。
太遗憾了，真的是太遗憾了。
所以你看，这个世界上第一快乐的人是不需要对别人负责的人，第二快乐的人就是从不回头看的人。
人往往都是快死的时候才发现，人生最大的遗憾就是一直在遗憾过去的遗憾。遗憾在电影里是主角崛起的前戏，在生活里是让人沉沦的毒药。",29天前发布
23297,14W正在看， ，，，， 我是二刷了。 UP主拍的真好啊， 文本写的真好。 还得100刷。。。,29天前发布
23298,眼里进了沙子[撇嘴],29天前发布
23299,眼里进了沙子[撇嘴],29天前发布
23300,我愿称之为，配视频的散文。,29天前发布
23301,“人生海海，山山而川，不过尔尔。”,29天前发布
23302,我的乖乖，一天涨几十万粉丝,29天前发布
23303,二舅一个平凡而伟大的人，人活着就是为了活着，在活着基础上活着自我，也愿生活善待你我！,29天前发布
23304,看得我又哭又笑,29天前发布
23305,“遗憾在电影里是主角崛起的前戏，在生活里是让人沉沦的毒药。”,29天前发布
23306,普通的让人感动,29天前发布
23307,年度最有意义的一个视频 值得反复观看,29天前发布
23308,牛逼,29天前发布
23309,"刚看完不久才800万
现在1160万了[热]",29天前发布
23310,人生最大的遗憾就是一直遗憾过去的遗憾,29天前发布
23311,像是纪录片，二舅不平凡不伟大，又很平凡又很伟大,29天前发布
23312,回村一周，我治好了我二舅的无忧无虑[藏狐],29天前发布
23313,平凡的人生，不平凡的二舅,29天前发布
23314,人生这个命题，最令人着迷，也最让人困顿,29天前发布
23315,一个精神和内心如此富有的人，为何还能有落魄这个词加之于身呢。,29天前发布
23316,盘在地下坚韧的根,29天前发布
23317,很久没看到这样的视频了…昨天刷到点进来一百多万播放，今天想起，又想再看一遍，发现经过千万啦。所以认真做内容是不会错的，敬二舅，也敬up[tv_点赞],29天前发布
23318,6688组合，帅呆了[打call],29天前发布
23319,看着看着就笑了，笑着笑着就哭了……,29天前发布
23320,????????,29天前发布
23321,人生最大的遗憾就是一直遗憾过去的遗憾,29天前发布
23322,感觉这个视频应该找到个好导演，拍一个电影,29天前发布
23323,不管那条路，都是通往成功的路,29天前发布
23324,"这是平凡的人的一生，又过着不平凡的事。平凡又努力，平凡却不平庸。
每天最简单的事是畅想以后，以后怎么样，以后过得多好多好。以后既可以是三十年，以后也可以是明天。三十年后我就退休了，可能压根没有退休这个词了。可明天我还是要准备考研。",29天前发布
23325,做第二快乐的人,29天前发布
23326,百感交集。,29天前发布
23327,二舅超酷的好吧,29天前发布
23328,给我看的头皮发麻,29天前发布
23329,喜欢真的好喜欢，想起来做的一些课外阅读理解了，描写的那些农村的人，看多少遍都不够。,29天前发布
23330,二舅，神一样的存在，太强了,29天前发布
23331,人类的赞歌就是勇气的赞歌，人类的伟大就是勇气的伟大!二舅是直面人生的真正勇士。,29天前发布
23332,我们村也有一个这样能干且乐于助人的的人，奈何走的太早了,29天前发布
23333,太佩服二舅了,29天前发布
23334,平凡的一生，精神丰富,29天前发布
23335,加油,29天前发布
23336,甘于平凡，这才是精彩的人生，,29天前发布
23337,用我的第一个一键三连向你的二舅致敬??,29天前发布
23338,伟大的平凡人,29天前发布
23339,我哭了,29天前发布
23340,看完了很想说点什么文艺的，但一打字就想起来插线板没插，所以给人生贴一句哈哈哈哈哈哈哈哈哈哈哈算了,29天前发布
23341,突然明了了,29天前发布
23342,[难过],29天前发布
23343,坦然面对人生的难，平凡的人伟大的人格。,29天前发布
23344,致敬二舅,29天前发布
23345,你二舅好厉害，我爸去学了木工，结果也没以这个为生，不过普通的也会捯饬。,29天前发布
23346,二舅不但智商高，情商也高，抗压能力又强，放到现在应该是了不得的人物,29天前发布
23347,一边哭一边笑，希望二舅和姥姥身体健康，能一直这么幸福下去啊！,29天前发布
23348,中国人老说生老病死，但生死之间何苦又加个老病呢？这可不是上天的不仁，而是怜悯。不然我们每个人都在七八十岁却还康健力壮之年去世，那对这个世界该有多么的留恋呢？那不是更加的痛苦吗？从这个意义上来讲，老病是生死之间的必要演习。,29天前发布
23349,这就是罗曼罗兰所说的英雄主义吧！,29天前发布
23350,今天第一次刷到这个视频，果断三连加关注！也祝二舅和姥姥身体健康，平安幸福[拥抱][拥抱],29天前发布
23351,我只看到一位坚韧而又浑身发光的劳动战士!,29天前发布
23352,这视频让我笑过之后大声的哭出来，觉得二舅可惜，也是觉得自己憋屈,29天前发布
23353,平凡的世界,29天前发布
23354,真正的强大，是心灵的强大不是肉体,29天前发布
23355,突然想起平凡之路里的几句歌词，“直到看见平凡，才是唯一的答案”,29天前发布
23356,他只是甘于平凡了，原来还是想出人头地的,29天前发布
23357,不知道为什么，眼泪止不住的流,29天前发布
23358,"文案很强，观后感无法用语言形容，或者是词穷。
觉得该放在教材里，好好学习学习做人应有的勤劳勇敢善良朴实，可是当今现实生活里，这些优秀品质该如何施展呢？精神与物质该如何取舍，毕竟改得了自己改不了别人，而改不了别人，最后是否能改变的只有自己的心态，而只改变自己心态不能改变真实情况又是不是精神胜利法？
希望大家真的能在各个层面取得胜利。[保佑]",29天前发布
23359,你的文案像孟烦了,29天前发布
23360,二舅是第二快乐的人,29天前发布
23361,想起了我的爷爷,29天前发布
23362,有着比二舅更好的条件，理当更加努力，做出成绩！,29天前发布
23363,看到这个想到了说唱巅峰对决的命题 人世间,29天前发布
23364,这故事入人心,29天前发布
23365,看了后内心有很多想说的东西，但又无法言语，只能说敬像所有像二舅这样平凡但是又不平凡的人,29天前发布
23366,我小姨也是，成绩很好，温柔善良，在大过年的时候发烧，打针打没了，也可能是治疗完，没了,29天前发布
23367,平凡的一生过得不凡,29天前发布
23368,@慕容千尘LCY 像看了一部小说,29天前发布
23369,令人敬佩的灵魂,29天前发布
23370,[喜极而泣][大哭][大哭][大哭],29天前发布
23371,发人深省的作品,29天前发布
23372,所以并不需要什么花哨的剪辑,29天前发布
23373,14万+人，第一次见,29天前发布
23374,你们都好会说话，我只会呜呜呜呜,29天前发布
23375,很难不三连啊，虽然币不多,29天前发布
23376,感叹主人公命运何其坎坷、何其曲折，更加感叹且无比钦佩主人公积极豁达的人生态度和不屈不挠的伟大灵魂！,29天前发布
23377,二舅，一个拥有信念感、朴实感、坚强感、创造感的平凡人，用自己的双手为生活增添色彩,29天前发布
23378,这个视频已经刷爆我朋友圈了,29天前发布
23379,[脸红],29天前发布
23380,"我在b站看过最牛逼的视频
我在人间听说的最牛逼的人",29天前发布
23381,绝绝子！,29天前发布
23382,14万＋,29天前发布
23383,"想起另一个纪录片里说的：
“只有自命不凡的人才会感到遗憾。”",29天前发布
23384,累了就回来看二舅然后再上路,29天前发布
23385,二舅实现了自由而全面的发展,29天前发布
23386,总觉得二舅很像身边的某位亲人，却也说不上是具体哪一位。也许二舅就是我们父辈的众生相，他们生于潦草年代，他们天赋异禀而又时运不济，他们认命也不认命。,29天前发布
23387,我以后估计会成为那个大多数的忘记开开关的老头。,29天前发布
23388,@东边的经,29天前发布
23389,敬畏,29天前发布
23390,还有什么理由不努力呢[打call],29天前发布
23391,几乎所有人都在鼓吹卓越，只有up主教会如何平凡,29天前发布
23392,我这辈子都无法这么豁达 我觉得我可能会早早结束自己的生命,29天前发布
23393,好久没有看到这样的解读人生了[奋斗],29天前发布
23394,test,29天前发布
23395,敬佩,29天前发布
23396,@-夏目绿子-,29天前发布
23397,这条长长的路，会通往何处？,29天前发布
23398,[打call],29天前发布
23399,好久没看到这种质量的长视频了,29天前发布
23400,内容充实且充满意义,29天前发布
23401,一键[热词系列_三连]了！祝福二舅！,29天前发布
23402,"视频的文案更像一篇会出现在小学课本上的一篇课文，从讲述一个人物，到感受一个时代。
没有大道理说教，没有鸡汤灌输。
读者结合自己的人生经历共鸣进行阅读理解共感，感受，感悟，感恩。。。",29天前发布
23403,充满生活哲思的人物故事。,29天前发布
23404,二舅让我想起我奶奶，她很平凡，也很伟大！,29天前发布
23405,[委屈],29天前发布
23406,是平凡的人不凡的一生，还是不平凡的人平凡的一生。其实就是平凡人的平凡的一生，这平凡里藏着命运的各种意外与惊喜，这才是平凡吧。看完这视频让我自愧不如，没有好好对待自己的人生。,29天前发布
23407,二舅的精神世界太丰富了,29天前发布
23408,看完觉得好遗憾啊，他本可以拥有更精彩的人生的，不难想象以他的天赋，可以达到令人难以企及的高度，好可惜啊，但是人生翻转，他却拥有另一种圆满，真正的把烂牌打成胡牌，只能说真的太牛了啊，二舅冲[打call],29天前发布
23409,人生从来不是一把好牌，而是如何把一把烂片打得精彩。,29天前发布
23410,不知道为啥，有一股力量在指引我来到了这里，这是新的开始,29天前发布
23411,做第二快乐的人，敬二舅,29天前发布
23412,看哭了。。真的,29天前发布
23413,每个人都在自己的路上走着，第二快乐的人是不回头看的人，祝大家都快乐,29天前发布
23414,真实是无法完全讲述的，人生的故事永远无法被尽数书写,29天前发布
23415,呜呜呜，看哭了,29天前发布
23416,当看到村里只剩下几百个老人的时候，我突然想到了我妈店里的一位老爷爷。他八十岁了，只有一位患精神病的女儿，四五十岁的人啥也不会干，基本的自理都不行，全靠一个八十岁的老人照顾。这些事还都是某一天老爷爷在我妈店里突然就说起来他家的事，最后那句话“如果我走了之后，她不就饿死了”真的很破防,29天前发布
23417,币比赞多系列,29天前发布
23418,[大哭],29天前发布
23419,[大哭],29天前发布
23420,二舅的才华，经由岁月打磨，变成了脊梁的模样。,29天前发布
23421,他已经把他能给得最好的给我了，我又凭什么说一切都不如别人呢？,29天前发布
23422,实在牛批，这也让我想到了我的四舅，他也是什么都会修，命运弄人啊,29天前发布
23423,顺应时代，无愧生命,29天前发布
23424,没有苦难。只有正能量 。这特么就是人间悲剧好吧,29天前发布
23425,阿甘,29天前发布
23426,敬二舅,29天前发布
23427,BGM是史密斯夫妇的tango,29天前发布
23428,我为什么会这么喜欢这个视频？因为它在歌颂平凡。,29天前发布
23429,平凡而伟大,29天前发布
23430,最近很丧，诸事不顺，但是我也相信功不唐捐，玉汝于成[大哭],29天前发布
23431,@梦白ii,29天前发布
23432,只有最底层的人民才能真正的感动到人，治愈到人[大哭][大哭],29天前发布
23433,借一句话，忘了哪里听的了，很适合。人生就是各自下雪，各有各的隐晦与皎洁,29天前发布
23434,敬二舅,29天前发布
23435,自由地活着，羡慕,29天前发布
23436,感谢[打call],29天前发布
23437,"up读了一本书给我听
这本书叫《二舅》",29天前发布
23438,视频配酒，一杯敬二舅，一杯敬自己！,29天前发布
23439,我在微信B站视频号看完 特意来三连[拥抱],29天前发布
23440,我愿称之为“新时代网络文学”。,29天前发布
23441,二舅才是真修行人！希望能多宣传这样给人力量的真实故事，少些乱七八糟的负能量。,29天前发布
23442,微博一遍，小破站一遍，一遍又一遍,29天前发布
23443,希望我也有打好烂牌的勇气和能力,29天前发布
23444,好感动啊,29天前发布
23445,看不懂是什么，不知道为什么会有这么多赞,29天前发布
23446,祝二舅和姥姥身体健康[给心心],29天前发布
23447,我们村的安玉也是这样的二舅一样的人生,29天前发布
23448,酷哥，太酷了！！！,29天前发布
23449,前几天被诈骗了，骗了我辛苦打暑假工的所有钱，这几天一直在崩坏，是一个狠狠的教训，谢谢这个视频，让我不要一直遗憾于遗憾之中吧，摆好心态，其他的交给警察叔叔吧,29天前发布
23450,唉 我爸也是小时候打针伤了耳朵，但他的确是能工巧匠，靠自己摸索学会了很多项技术，很聪明、勤奋，性格好，心态也特别好。但我还是觉得很惋惜。,29天前发布
23451,让人想用在作文里,29天前发布
