index,comments,time
18938,金子到哪都是金子,29天前发布
18939,麻木到没感觉了，看来是药吃多了,29天前发布
18940,二舅，二就，高就,29天前发布
18941,感觉这个可以拍个电影，二舅平凡而独特的一生，也见证了我国几十年的巨变,29天前发布
18942,看哭了,29天前发布
18943,普罗大众还是与平凡的普通人更有共鸣啊[爱心],29天前发布
18944,二舅的那个回眸，仿佛是在注视每一个遗憾的人，告诉他们，即便人生遇到了这样的事，也能向前走得很好。,29天前发布
18945,受教了，尊唐，人要往前走会有前行路,29天前发布
18946,没看懂啥是精神内耗？？？这个词啥时候流行的我老了？,29天前发布
18947,当年先生退出文坛我是极力反对的,29天前发布
18948,@北极野人的南极女友 看这个泪目了,29天前发布
18949,那时候的人，抑郁症一定很少吧。,29天前发布
18950,那四针是别人故意的，二舅成绩太好，别人嫉妒,29天前发布
18951,在B站很少有短视频会让我刷几遍的！！！！！,29天前发布
18952,愿上帝保佑每一个平凡中倔强的灵魂，以马内利！,29天前发布
18953,这个视频火了开心的同时也很担心，希望某些妖魔鬼怪不要为了蹭热度去打扰他们的生活，我们需要的是二舅的精神，不是你那所谓的直播画面。,29天前发布
18954,高考满分作文,29天前发布
18955,有多少人在惦记着过去的快乐,29天前发布
18956,14……………万人？[热词系列_知识增加][热词系列_芜湖起飞],29天前发布
18957,谢谢你 我被治愈了 最近太迷茫了 浑浑噩噩不知所措,29天前发布
18958,"哭了
第一滴泪，为他的不幸
第二滴泪，敬他的不屈
第三滴泪，恨我自己没他这份豁达",29天前发布
18959,????,29天前发布
18960,《孤勇者》是为二舅量身定做的,29天前发布
18961,就像抓住救命稻草般认真看完视频，很喜欢[难过]但是我精神内耗太严重了，二舅的故事救不了我[难过],29天前发布
18962,Up主的文案可以入选高考语文试卷 文学类文本阅读了。,29天前发布
18963,大舅呢？,29天前发布
18964,真的好！,29天前发布
18965,@此人目前没想好名字 [打call],29天前发布
18966,谢谢你，如果我做不成第二快乐的人，我就去做第一快乐的人。写在这里，以防我以后忘记,29天前发布
18967,人，忍，韧,29天前发布
18968,这个视频真的很喜欢 谢谢,29天前发布
18969,我还是难过，这么优秀的人却在少年时候腿废了，学业也荒废了。,29天前发布
18970,不回头，不后悔，不沉沦，谢谢二舅,29天前发布
18971,心到淡然处，人生自坦途,29天前发布
18972,第二快乐的人，是从不回头看的人,29天前发布
18973,一个视频涨了100w粉。。。,29天前发布
18974,该是多么坚强的心，才可以如此笑对生活,29天前发布
18975,我们不是为了什么而活着，只是为了活着而活着。,29天前发布
18976,如果他那腿没有废，我国又多了位人才，可惜啊,29天前发布
18977,浪漫的悲苦,29天前发布
18978,每个人的一生都是一本故事,29天前发布
18979,平凡的不平凡大众,29天前发布
18980,"“二舅认真的活了半生，我分享了二舅的故事，大家听了还有点触动，这三者合起来就是个美好的小故事，美好的故事应该有一个美好的结尾，这些年大家看过的烂尾了的美好故事还少吗？让二舅安安静静的陪姥姥生活在那个小山村吧，那就是这个故事最美好的结尾。”——二舅外甥的话
平凡的、熟悉又有些回不去的乡村、小镇、县城……平铺直叙的、真诚的又很有些缺憾的述说、镜头……因为“二舅”、“精神内耗”，因为刷屏，所以好奇，看了视频看了文字，确实更好的是故事最美好的结尾……有了触动，不要去打扰与破坏，努力更好的平凡的生活。",29天前发布
18981,所以生命啊 它璀璨如歌,29天前发布
18982,太牛了，昨天才看完，今天家长居然给我推荐了,29天前发布
18983,二舅总有办法，大概才是作者体会到以及想分享给大家的一种生活态度和领悟。无论面对什么样的困境，二舅总有办法，那个办法可以是面对实际问题的穷究自身之力迎难而上，也可以接受精神世界和人生中残缺的苦难，困顿一时终究只是一时，努力活着努力负责，给姐妹嫁妆给女儿买房给老母养老。从来不知道这么天才的人在面对那样巨大的残缺还能绽放如此的光彩,29天前发布
18984,伟人您何时再来,29天前发布
18985,幽默的语气讲普通人的曲折人生,29天前发布
18986,很久没有看到这么精彩的视频了！让人深思！[支持][支持][支持],29天前发布
18987,@是黄西瓜 好牛逼,29天前发布
18988,平凡的人过着日常的生活，你的二舅记录，给我内心小小的触动，很励志，谢谢你的记录分享。,29天前发布
18989,敬二舅  让近日找不到工作emo的我被治愈了很多[拥抱][拥抱][牛年],29天前发布
18990,活的没有二舅通透，也没有外甥的欣赏，人生悲哀，苟且偷生,29天前发布
18991,坚持就是胜利,29天前发布
18992,"“人生有三次成长：

一是发现自己不再是世界的中心的时候，
二是发现再怎么努力也无能为力的时候，
三是接受自己的平凡并去享受平凡的时候。”",29天前发布
18993,相当于看了一篇中长篇小说。,29天前发布
18994,不愧是二舅的外甥，有东西,29天前发布
18995,@我不想学奥赛了,29天前发布
18996,看完啦，拍得挺好的，只是对于我的共鸣没有很多。每个人都平凡又不凡，不是经历了苦难再坚强就是财富，精神内核不用别人治，不用别人给，自己想清楚了就好，成功没有定义，只是现代生活很浮躁，感觉好像平淡就很不容易，但对于大部分来说平凡活着就很好。,29天前发布
18997,排除万难 去争取胜利,29天前发布
18998,牛逼,29天前发布
18999,从不回头看，积极向上的活着真好,29天前发布
19000,朋友推荐的视频，挺好的[tv_难过][tv_大哭],29天前发布
19001,遗憾在电影里是主角崛起的前戏，在生活里是让人沉沦的毒药。,29天前发布
19002,现在的年轻人 即使看到二舅这样的榜样 是否真的会脱离摆烂现象呢？一看而之还是奋发图强？,29天前发布
19003,“人生不是胡一手好牌，而是把烂牌打得精彩”,29天前发布
19004,共鸣，是因为我们父辈那一代人有很多经历都相似。致敬父辈们！平凡而伟大着！,29天前发布
19005,"你大舅你二舅都是你舅
《活着》的富贵",29天前发布
19006,看完，听了一天《我来人间一趟》…再投2个币,29天前发布
19007,看完有一种之前看完平凡的世界的那种感觉[支持],29天前发布
19008,看哭了,29天前发布
19009,现实里有各种二舅！,29天前发布
19010,标题与内容不符合[嫌弃],29天前发布
19011,看到了视频这个载体的无限潜力。讲好那些故事，自然会带来震撼人心的力量。,29天前发布
19012,全力备考遗憾未能进面，这短暂几天我一直处于低迷期，干什么都提不起劲。谢谢二舅，也谢谢up，我又有了重新开始的勇气与自信。,29天前发布
19013,做的太好了。,29天前发布
19014,起立,29天前发布
19015,一撕就会。。肉皮,29天前发布
19016,????????,29天前发布
19017,世界上只有一种英雄主义，那就是认清了生活的本质后，依然热爱生活??,29天前发布
19018,二舅历害,29天前发布
19019,真是高水平的视频，惊为天人,29天前发布
19020,太好了，让我想起了童年回忆！！！,29天前发布
19021,感动三连,29天前发布
19022,@岩胜的狗 有空好好看看,29天前发布
19023,二舅一定看过《阿甘正传》……[笑哭],29天前发布
19024,这文案，这旁白，有种平凡的世界的感觉,29天前发布
19025,敬二舅！敬每一位努力生活的人[干杯],29天前发布
19026,istp真的迷人,29天前发布
19027,我们生来破损 用活着来修修补补,29天前发布
19028,我家的上海床跟视频里一摸一样，现在还在用,29天前发布
19029,都说像余华，我感觉有几分莫言的味道[支持],29天前发布
19030,其实像二舅这样的人中国没有10万也有8千为什么这个视频能爆火出圈？背后其实只是顺应了大家的情感需要“二舅”只是一个“引子”而已大家只是压力大，却难以启齿“我好累、我压力山大、我精神不停内耗、你知道吗？你能关心下我吗？”正好“二舅治好我的精神内耗”能帮大家委婉的表达出来这种情感于是就有了所谓的“共鸣” ——疯狂转发于是爆火出圈,29天前发布
19031,文案写得太好了,29天前发布
19032,用词好棒,29天前发布
19033,"人生漫漫旅途，二舅的经历就像是与自己的人生和解，在不一样的路上发挥自己的光芒，而不是怨天尤人。
敬二舅",29天前发布
19034,好棒,29天前发布
19035,下午看了一遍文章，听了三遍视屏，晚上又看了一遍[微笑],29天前发布
19036,活着，只是活着,29天前发布
19037,整个视频像首诗一样，让人感觉到一种水一样的平静和安然。一开始还以为是自导电影，看到后面才知道这是和我同一个维度里的真实人生。视频的最后一段，屏幕上二舅日记的寥寥数语，镜头里二舅掺着拐杖坚定向前的背影，up古代侠客一样荡气回肠的念白和bgm，看得我忍不住流下了眼泪，“下定决心，不怕牺牲，排除万难，去争取胜利！”，愿你我都成为不屈的胜者！谢谢up的这支视频，真的，非常感谢！,29天前发布
19038,每个人的生活不就是这样么：笑中有哭，哭中有笑。但是有些人就是这样普通的活着，他们的倔犟、坚强、乐观会突然就震撼了你的心。,29天前发布
19039,每个人的生活不就是这样么：笑中有哭，哭中有笑。但是有些人就是这样普通的活着，他们的倔犟、坚强、乐观会突然就震撼了你的心。,29天前发布
19040,顶我上去，抖音上有盗版这个视频的！,29天前发布
19041,这才明白我所有的努力，不过完成了普通的生活,29天前发布
19042,镇站之宝,29天前发布
19043,为什么看着有一种说不上来的伤感,29天前发布
19044,这故事真是怎么看也不够[鼓掌],29天前发布
19045,致敬二舅，致敬我身边同样的人，我外公！,29天前发布
19046,而我却把一手好牌打的稀烂,29天前发布
19047,俺姥姥也是这种人，作为家里的老大只上学上到一年级就被父母强行辍学帮家里干活，弟弟妹妹们都是初中毕业，我觉得让她上学在那个年代也起码是个大学生。但姥姥是个很聪明的人，自己看报纸就学会认大部分字了，小时候我偷着玩电脑总会被她发现，我很怀疑我的智商是遗传的姥姥。看到这个视频就想起她了，在这个匆匆忙忙的年代，让我们都和二舅学习，多尽孝心[tv_微笑][tv_微笑],29天前发布
19048,@四月闻歌 太棒了,29天前发布
19049,我们都在用力的活着,29天前发布
19050,再来一遍,29天前发布
19051,敬二舅,29天前发布
19052,"世界上只有一种英雄主义,那就是看清生活的真相依然热爱生活",29天前发布
19053,像是鸟鸟的文稿,29天前发布
19054,有一种学生时读的那些课文的感觉，当时读不懂，现在有了感触,29天前发布
19055,真的哽咽了，眼泪刷刷地往下流，真想回老家把它分享给爷爷奶奶，他们一定有更多共鸣。说不出什么漂亮话，我只想说：致敬！希望自己朝着胜利继续为梦想拼搏！！！,29天前发布
19056,优美。,29天前发布
19057,我希望日后每一天都可以以第一次看完这个视频的心态、感悟来度过！！！,29天前发布
19058,写的真好，感人！,29天前发布
19059,我张开干涩的唇，却吐不出应景的文，二舅这一生看似一直输，实则一直赢，穆然一身可有一个和睦的家，没上大学却又学富五车，人生在他身上赢了无数盘棋，可二舅只在乎充实的过程而不去在乎输赢，换句话说，他还有滋有味的活着，他就一直再赢，与他相比，一直纠结过去的我显得如此可叹可悲，愚不可及，但我放不下，人间放的下的能有几人？人生，难得糊涂。,29天前发布
19060,一笔一画，一颦一笑，都是打在我脸上的耳光。我还有什么理由去虚度光阴？,29天前发布
19061,好有深度的视频。最平淡的叙述却带来最深刻的震撼，看完后千言万语却无处诉说。只能说，这才叫活着。,29天前发布
19062,@魔咔啦咔 宝贝快来,29天前发布
19063,"二舅的生活有着古典式的浪漫。[热词系列_知识增加]

”认识你自己“
”凡事勿过度“
”切勿轻诺“
——德尔斐神谕",29天前发布
19064,求bgm,29天前发布
19065,二舅是每个普通人的一面活着的哈哈镜,29天前发布
19066,二舅,29天前发布
19067,草 十四万人正在看,29天前发布
19068,谢谢！,29天前发布
19069,刚在微博上看到，一打开b站就出现了[微笑],29天前发布
19070,学着去理解一切,29天前发布
19071,我的一手好牌打的稀烂，，，,29天前发布
19072,那时候农村的能人！老家有个77年差1分没上学的，每次我都敬他老大,29天前发布
19073,认清生活的真相，并且仍然热爱他[奋斗][奋斗][奋斗],29天前发布
19074,"二舅的笑容中也有无奈……
这片土地上的许多人也一样！",29天前发布
19075,一人血书写成小说,29天前发布
19076,泪水控制不住的从我的眼睛里流出来，鼻涕阻塞了我的呼吸，内心感到从未有过的平静。,29天前发布
19077,编的好,29天前发布
19078,我想起我的外公，也是一位非常优秀的人,29天前发布
19079,二舅的人生态度吹散了我这个社畜的浮躁之气[打call],29天前发布
19080,敬二舅,29天前发布
19081,世界上只有一种英雄主义，那就是知道了生活的真相后依然热爱着生活：世界上只用一种成功，那就是用自己的方式过一生。,29天前发布
19082,和过去和解,29天前发布
19083,牛逼,29天前发布
19084,普通的能力者，不知道怎么表达,29天前发布
19085,真的好,29天前发布
19086,在这片土地上，大部分人忙忙碌碌却连平凡也很难换到。,29天前发布
19087,导演小策出来挨打！！这才是二舅,29天前发布
19088,一切都是最好的安排[OK],29天前发布
19089,二舅就像鲁迅先生写的书里的主角一样！,29天前发布
19090,看完泪流不止，失业一年多的我心情down到谷底，看到二舅的人生，突然明白了，为什么要一直计较过去呢，为什么不能勇敢一点，对生活热情一点呢？,29天前发布
19091,被生活所迫像二舅一样的人大有人在，这没有治愈的感觉，这只能看到底层人民对于活下去和活的好的人的强烈渴望，底层人民包括我，也包括很多的你，没有共鸣的人请略过，没其他意思,29天前发布
19092,像是读了篇散文,29天前发布
19093,容我大声喊一句，二舅nb！！,29天前发布
19094,作者一定很喜欢鲁迅先生的朝花夕拾,29天前发布
19095,一开始以为要躺平，没想到后面这么励志[大哭],29天前发布
19096,看完了，没由来的感到悲伤，眼泪毫无征兆地出来了。,29天前发布
19097,最后扯上民族就有点画蛇添足了，其实世界上其他民族也一定会有这种乐观向上的人，敬的是自己，跟其他无关[吃瓜],29天前发布
19098,像哈姆雷特一样，能激发每个看客不同的思考，文案很棒,29天前发布
19099,感谢这个视频，内耗好一点了,29天前发布
19100,这文案，这才是现在短视频应该有的文案，这种诉说和感悟是非常能够让人去体会的，二舅是被抛弃的天才，作者的文笔也是非常惊艳,29天前发布
19101,“人生最大的遗憾就是一直在遗憾过去的遗憾”,29天前发布
19102,我真的哭死[大哭][大哭][大哭],29天前发布
19103,这是真实的故事吗,29天前发布
19104,人民万岁,29天前发布
19105,我的父亲是村里成绩最好的，然后空军验兵差一步，说是天天吃辣椒嗓子不好。后来也是做木工。有了老婆，大儿子小时候就没了。后来有了小儿子，在孩子5岁的时候，做工时触电身亡。,29天前发布
19106,给二舅寻个老伴吧,29天前发布
19107,其实想说点什么的，但是想来想去还是只想说：真好。,29天前发布
19108,谢谢二舅[大哭][大哭][大哭][大哭][大哭][大哭] 让我相信人生可以活得开心自在，可以有爱，可以和大家说的不一样，谢谢二舅让我爱这个世界，祝您身体康健[给心心],29天前发布
19109,是真人真事还是拼凑的故事？,29天前发布
19110,"遗憾谁没有呢?
人往往在都是快死的时候，
才发现人生最大的遗憾，
就是一直在遗憾过去的遗憾。",29天前发布
19111,唐，一天涨了50万粉丝。。。[妙啊],29天前发布
19112,“排除万难，去争取胜利。”,29天前发布
19113,敬二舅！,29天前发布
19114,"即使生活给你痛击，你还是坚强的走了下去
那个年代确实不容易",29天前发布
19115,希望大家能够喻之于怀吧,29天前发布
19116,老病是生死之间的必要演习，绝了，解答了我多年的疑惑,29天前发布
19117,up的逻辑很强悍，实话讲，比我刚看的那几篇文献逻辑好。,29天前发布
19118,他公平[委屈]希望自己像他一样勤劳，一样善良，一样不埋怨，一样快乐地活着～,29天前发布
19119,夜色难免黑凉，前行还有曙光,29天前发布
19120,忽然想起了人生海海,29天前发布
19121,人物可敬，叙事顺畅，但远不至于治好精神内耗，只觉得众生皆苦,29天前发布
19122,哇，这个视频热度好高，投币比点赞还多[支持],29天前发布
19123,人民万岁,29天前发布
19124,@南千代,29天前发布
19125,一天涨了57万粉丝，我的天！昨晚刷到这个视频的时候 那时候播放量307万，今天全网爆了直接1465万播放量！,29天前发布
19126,好的，我支楞起来了,29天前发布
19127,这个视频也让人生低谷的我明白，我该再坚持坚持，再努力努力，春暖花就开了,29天前发布
19128,好,29天前发布
19129,这种像纪录片一样的微电影，拍的很好，很能触动心弦。,29天前发布
19130,他很好，因为他公平,29天前发布
19131,我有多久没看到这样好的视频了 谢谢up,29天前发布
19132,写得好,29天前发布
19133,看完之后才发现早已起了一身的鸡皮疙瘩，心中十分感慨， 二舅的经历让我惊叹。同时也让我意识到人生无常，且行且珍惜，谢谢up[tv_腼腆],29天前发布
19134,这是我第一次在一个视频大火之前三连的，回来留言，眼看着他的点赞数从几万到几十万，再到几百万,29天前发布
19135,正是这样的人，撑起了一个家庭，一个社区，进而撑起了一个时代，一个民族……他们是真正的强者，生活的胜利者。他们被无数的诗句赞颂，无数的歌谣传唱。他们的形象在史诗里被幻化成了神灵、英雄……拥有不可思议的神秘力量。但他们只是人，只是顶天立地的人。,29天前发布
19136,二舅是平凡中的不凡,29天前发布
19137,不希望有些人看到这热度，去打扰村子，去打扰二舅,29天前发布
19138,"赠二舅
莫笑草盛花不知，
株株皆有不平事。
深泉幽芳难现世，
今闻孤菊婷立此。
心感雪芹泉有知，
五柳若晓亦相惜。
本诗许是谬赞之，
平凡人家平凡事。
一个高中生随手做的，不懂格律，难压韵脚。
大家看着图一乐吧，不喜勿喷。[doge][doge]",29天前发布
19139,"赠二舅
莫笑草盛花不知，
株株皆有不平事。
深泉幽芳难现世，
今闻孤菊婷立此。
心感雪芹泉有知，
五柳若晓亦相惜。
本诗许是谬赞之，
平凡人家平凡事。
一个高中生随手做的，不懂格律，难压韵脚。
大家看着图一乐吧，不喜勿喷。[doge][doge]",29天前发布
19140,二舅如果是读书，也必是所从事行业的大才,29天前发布
19141,太棒了，我爱这个,29天前发布
19142,想起老村子里嗯每个人，何尝不是有这么简单的一长串故事呢？什么时候才能回到那里，去看看我来过的地方，那群可爱的平凡人。,29天前发布
19143,今天先看了文字，从文字就已经感受到了一种余华式简概版的活着，但又比《活着》更让人动容，更能让人感同身受；现在看完了视频不禁更是感叹生活和命运对这位可敬可佩之人的捉弄，视频以这种听似评述一位与已毫无瓜葛的人的一生语气，显似毫无感情，实则让人体会到二舅对人生对命运的淡然。,29天前发布
19144,发生了什么，前天看的时候up99万粉，100多万播放，今天165万粉，1400多万播放[囧],29天前发布
19145,“世上只有一种真正的英雄主义，就是认清了生活的真相后依然热爱生活。”,29天前发布
19146,这个肯定很快会拍成电影，超级火爆，真实，深刻有教育意义【强】【强】【强】,29天前发布
19147,"世界上只有一种真正的英雄主义，那就是，在认清生活的真相后依然热爱生活。
一一罗曼．罗兰",29天前发布
19148,为什么给儿女买房就是可怜？,29天前发布
19149,上帝关上门的同时 也会为你开一扇窗 敬二舅,29天前发布
19150,不知道为什么，看着看着眼泪就掉下来了，不知道哪个点触动到我，回过神已经泪流满面了,29天前发布
19151,看我这个视频我想家了，周四的票说走就走。,29天前发布
19152,羡慕这些已经活的通透了的人。希望我老了，也能如此。,29天前发布
19153,@徐多火,29天前发布
19154,我那边镇上一个人，现在有60岁了。叫赵天书（大概是这两个字，只听大人这样叫）考上清华，在火车站让小便憋坏膀胱，瘫了。小时候在街上看见他非常显眼，他自己做了个轮椅，类似三轮车改装。开了家电器店，自己什么都会修。,29天前发布
19155,请尊重作者想法。请不要强扭的瓜。打扰别人的生活。也请尊重2舅。他已经很难了别再给一堆选择的时代洪流堆放在他的面前让他去适应。去改变。,29天前发布
19156,写得好好啊[蛆音娘_吃惊],29天前发布
19157,????,29天前发布
19158,又一个币比赞多的，大家都在见证，共鸣，思考，感悟.....,29天前发布
19159,生命之树长青。。。,29天前发布
19160,是农村生活的老一辈,29天前发布
19161,看哭了,29天前发布
19162,也不是励不励志吧，生活本来就这样走着，不同人有着不同的选择，只是要认真生活，毕竟我们也才活着这一辈子,29天前发布
19163,涨粉速度太恐怖了d(?д??),29天前发布
19164,点进来之前就知道这个视频很震撼，但是看完还是被深深被打动了,29天前发布
19165,平凡而伟大的普通人,29天前发布
19166,敬所有像二舅这样的普通人,29天前发布
19167,up主的文风好像姜文的电影的感觉[doge],29天前发布
19168,这篇文章不进小学语文课本[打call],29天前发布
19169,说的太好了,29天前发布
19170,“我可以消费二舅换一期爆红视频，但二舅不可以消费他自己换取一些收入改善生活，因为我消费二舅属于人文关怀，二舅消费自己就是不体面的流量变现了。”,29天前发布
19171,可以选择太多，反而让人不知道怎么选择。二舅在仅有的天空里成了飞的最高的那只鹰。,29天前发布
19172,兄弟！我是为了你在来BB站,29天前发布
19173,我想到了《活着》,29天前发布
19174,新时代语言大师,29天前发布
19175,这为啥这么火啊[笑哭]，前阵子唐山罗翔的评论视频也没这么火也才不到10w同时观看,29天前发布
19176,苦难没有任何价值，但乐观总也没什么不好的，不过现实世界的价值观很残酷，大多数人根本没有选择，要活得下去也只能保持乐观了,29天前发布
19177,活着,29天前发布
19178,他 公平。,29天前发布
19179,我愿称之为近些年来读的最好的文学作品，也是我到B站以来看的最好的视频。,29天前发布
19180,何时会产生对死的恐惧？现在想来只有闭眼之前想到一生中所有遗憾的那一刻了。,29天前发布
19181,@我是无敌的小崔崔,29天前发布
19182,多好，就这么普通的一生活的精彩就可以了,29天前发布
19183,认清生活，热爱生活,29天前发布
19184,荒谬，在加缪看来，仅仅是个出发点，重要的不是认识到荒诞，而是对荒诞采取什么态度，在荒诞的条件下人应该如何行动，是以死来结束荒诞状态，还是以反抗来赋予人生某种意义,29天前发布
19185,余华感！姜文感！我想哭,29天前发布
19186,不要回头看。,29天前发布
