index,comments,time
14677,如果汪曾祺先生还活着 [大哭]二舅也一定成为他笔下不落世俗，闲云野鹤而又归于平凡的一页吧。二舅的这一生已经充满戏剧，又同散文般形散神聚了，而遗憾是人生常态,29天前发布
14678,[支持][支持],29天前发布
14679,可敬的是精神，可悲的是只能靠“自愈”而已,29天前发布
14680,好看,29天前发布
14681,可我爷爷有点像,29天前发布
14682,不知道用什么语言可以形容我此刻的感受，这绝对是我在小破站看过最高质的视频，平凡而又伟大令人动容，这也许就是生活的真谛吧,29天前发布
14683,每个村里都有自己的二舅。,29天前发布
14684,朴实无华，却又牵动人心,29天前发布
14685,敬二舅,29天前发布
14686,岁月悠悠，衰微只及肌肤。热忱抛却，颓废必至灵魂。,29天前发布
14687,up的词很幽默，一边笑一边流眼泪[笑哭],29天前发布
14688,@Fionaishappy,29天前发布
14689,是作为灵魂的胜利，凌驾于一切现代野蛮无知之上,29天前发布
14690,上天把这么一个天才拦在了他出生的小地方，那他让自己成为这个小地方的天。,29天前发布
14691,谢谢up给我带来的启示[爱心],29天前发布
14692,"向二舅致敬，向每一个平凡又闪光的灵魂致敬。真正的强者不会被疾病或者苦难打倒，无论身在何种境地，都能安闲自处，仍然发光发亮。
天行健，君子以自强不息；
地势坤，君子以厚德载物。
诸君共勉",29天前发布
14693,看完很感动。想回家看看父母。,29天前发布
14694,看完觉得不舒服,29天前发布
14695,平凡却又不平凡[支持][支持][支持],29天前发布
14696,这是很酷的一个作品，不只是一个视频,29天前发布
14697,"1  同样都在刷短视频  同样都刷的津津有味 
2  在超解压的环境里一直活在自己“正确”的价值观的顶端
3  感动可能来自“专注”  大神可以发射脑电波来达到专注一件事  二舅的专注更已经成为习惯  成为众生所谓的“气质”  更跟环境形成巨大矛盾   确实炸裂。。。鼠辈都退下！！！",29天前发布
14698,这个世界上第一快乐的人，是不需要对别人负责的人。第二快乐的人，是从不回头看的人。（复制）[妙啊],29天前发布
14699,??????,29天前发布
14700,自己已经30了，却依旧无能，不能完全承诺孩子今后的保障，不能承担养育父母的重担，自己还在生活中拼命挣扎，人生真的太现实太难了，但是日子总是向前，人还是得朝前看。,29天前发布
14701,文案写的真好,29天前发布
14702,身残志坚，二舅就是个对社会有用的好人。,29天前发布
14703,到现在还是11w正在观看[脱单doge],29天前发布
14704,感动,29天前发布
14705,平凡是属性，不是理由,29天前发布
14706,[保卫萝卜_哭哭],29天前发布
14707,[Cheers UP Emoji_拜托-9][Cheers UP Emoji_大哭-5],29天前发布
14708,感谢看见这个视频,29天前发布
14709,我也去了异地，在一个没有亲戚朋友的城市待三年了，虽然偶尔孤独，但是我觉得在喜欢的城市生活，这些苦楚是值得的,29天前发布
14710,入站必刷[热词系列_吹爆],29天前发布
14711,@歡愉oooo,29天前发布
14712,令人敬佩的精神与人生,29天前发布
14713,我的弟弟在他一两岁的时候因为生病被同村的医生打针打死了，具体我记不清了，因为这件事谁都不愿意提起…听母亲说父亲当时把家里所有的照片都摔了撕了，难怪我小时候的照片一张都没有…在当时那个年代(九十年代)诉诸法律对身处农村的我们几乎是没想过的…如今我自己也是母亲，慢慢体会到这件事对当时的父母打击是有多大！我的母亲有习惯性流产，当时是好不容易才怀孕生下弟弟的，所以可想而知这种悲痛…现在三十多年过去了，也从没有人提起，这种逝去成了他们心中永远不能提及的痛…人生无常，命运弄人,29天前发布
14714,不知道为啥看的我热泪盈眶，为二舅坚强 乐观的生活态度,29天前发布
14715,二舅是个有大智慧的人,29天前发布
14716,敬二舅,29天前发布
14717,天呐赤脚医生。。。我爸靠着当年爷爷买回来的这本书，hold了家里所有人的病。。,29天前发布
14718,是呀，我们还有什么理由在这边“自我内耗”呢,29天前发布
14719,是呀，我们还有什么理由在这边“自我内耗”呢,29天前发布
14720,@智慧女孩不许秃头 来看二舅,29天前发布
14721,敬二舅[保佑][保佑][保佑],29天前发布
14722,像一部小电影。,29天前发布
14723,“第一快乐的人是不用对别人负责的人”,29天前发布
14724,几个关键词：赤脚医生，拉帮套，6688，江苏金捷，乔丹皮蓬默契走位,29天前发布
14725,看完整片，不知道为什么有一种在看高中语文课本其中一章的感觉[惊喜],29天前发布
14726,真得很好，结合历史使人物叙事更加伟大。我以为文学要在短视频时代灭亡了，真的很好的方式。原来大家也不是不爱文学，只是没用用到喜欢的方式。,29天前发布
14727,平凡人也有人生的高光时刻,29天前发布
14728,因为父辈的关系 以及钢铁侠自己造自己盔甲的 原因，我曾经很自豪自己造这种行为，如今才意识到这是一种原始的落后的骄傲，只能在物质信息交流匮乏的年代代表生产力，如今，自己造，和不能自己造的原料获取 都很重要。因为原料升级了，这些原料自己是造不出来的。,29天前发布
14729,人死之后一定会上天堂，因为人间就是炼狱,29天前发布
14730,二舅不愧是当年的天才少年,29天前发布
14731,他一生的斗争全在这一亩三分地里了，但是他活得比我们任何人想的都要广大，敬坚韧不拔的意志，敬一颗伟大常青的平凡之心。,29天前发布
14732,原来是你[doge],29天前发布
14733,《武训传》,29天前发布
14734,可以拍电影，如果可以像现实版的活着激励无数人努力奋斗，不错的选择,29天前发布
14735,？这种司空见惯的事也能有这种热度？随便拍点视频，写几句模板式的文案，就吹上天了？盲流的可怕,29天前发布
14736,疯了，两天两千万[打call],29天前发布
14737,看完了居然没啥感觉，看来我是回天乏术了[微笑],29天前发布
14738,生活不是我们活过的日子，而是我们记住的日子，我们为了讲述而在记忆中重现的日子。,29天前发布
14739,老舍当年写下《骆驼祥子》是希望以后世上再无骆驼祥子，而不是希望人人变成骆驼祥子。,29天前发布
14740,平凡的生活本就是一部史诗,29天前发布
14741,@三维菜狗,29天前发布
14742,"最后一句意味深长：下定决心，不怕牺牲，排除万难，去争取胜利。
对个体而言，意味着从战术到战略（某种意义的战术）
从国家而言，从战略到战术。
个体和国家脱节，可能是主要矛盾。",29天前发布
14743,平凡而又伟大,29天前发布
14744,我二舅也是，家里太穷开始学木匠，老家好多桌子椅子都是他做的，后来恢复高考，去了985，现在是教授。二舅都好厉害啊,29天前发布
14745,shout out to 二舅,29天前发布
14746,[大哭][大哭][大哭][大哭][大哭][大哭][大哭],29天前发布
14747,一个人至少拥有一个梦想，有一个理由去坚强，心若没有栖息的地方，到哪里都是流浪。短短十几分钟的视频，却描绘了二舅的一生，朴素诙谐的语言叙述着命运多厄而又不甘平庸的二舅。人生如梦，想到二舅的命运内心不由自主的生出几分遗憾，在看到二舅“我命由我不由天”的坚强时又感到暖心，我们的二舅，很让人感动！,29天前发布
14748,还在为没有方向而感到迷茫吗？偷偷告诉你一个历代先贤都没忽视到的事实：无论朝哪走，都是向前走,29天前发布
14749,想起爷爷了[大哭][大哭][大哭],29天前发布
14750,二舅很庆幸有你这个外甥，让他名扬四海，其实这并不是他想要的，他只想每天有活干，能赚点小钱，想吃啥能有钱舍得买，偶尔有人关心，平素在人前还有点话语权。,29天前发布
14751,@Damocles嘻 @大蓝闪西枭 @普林斯顿的夏天 @厘米kin @一只苏醒的羔羊,29天前发布
14752,笑着笑着哭了,29天前发布
14753,已经关注你啦，你真的是个大导演，你应该继续拍片，太爱你啦！你的这个视频道尽了人间冷暖[支持][支持],29天前发布
14754,"人生最大的遗憾就是一直在遗憾过去的遗憾。
敬二舅，敬未来。",29天前发布
14755,Up主帮帮二舅姥姥,29天前发布
14756,感叹没有有艺术的源泉，实际上艺术的闪光点就存在于生活之中，平凡的生活更意味深长。,29天前发布
14757,@是阿野啊啊,29天前发布
14758,每天都在跳poping的老太太，这一句话让人很心酸。很简单的一个形容词。,29天前发布
14759,"不知道为什么这么火.  B站有个纪录片, &lt;人生第一次&gt; , 每集都比这好.",29天前发布
14760,生活高于电影,29天前发布
14761,看了前面的简介梗概，感觉会在用在以后的考试里面出作文出阅读理解的题目，或者上教材[笑哭],29天前发布
14762,致敬，好好生活,29天前发布
14763,这可能就是平凡的伟大吧，祝福二舅,29天前发布
14764,我感觉好像没有治好我的焦虑症,29天前发布
14765,敬二舅，谢谢二舅,29天前发布
14766,我觉得可以上小学课本,29天前发布
14767,成宝拉说，不要小看人生啊！,29天前发布
14768,没看，先一键三连，等我休息了，认真看看,29天前发布
14769,还有88经验就要渡劫lv6了，也想与二舅一样渡劫成功 请各位上仙祝我一赞之力[OK][打call][打call],29天前发布
14770,他公平,29天前发布
14771,此视频让我又一次看到了新时代的希望,29天前发布
14772,看哭了,29天前发布
14773,有一种残老村村长的意思,29天前发布
14774,propoganda,29天前发布
14775,关键在于二舅他从不抱怨，真正的勇士敢于直面惨淡的人生，活出自己的精彩,29天前发布
14776,"二舅回头看了呀
但是他带着笑呢",29天前发布
14777,@LLEI_ [奋斗],29天前发布
14778,敬二舅，也敬我的父亲母亲，他们都是平凡而坚强的人。是我学习的榜样。,29天前发布
14779,敬二舅，也敬我的父亲母亲，他们都是平凡而坚强的人。是我学习的榜样。,29天前发布
14780,厉害啊,29天前发布
14781,敬二舅,29天前发布
14782,真的很厉害,29天前发布
14783,虽然我不配，但还是点了三连,29天前发布
14784,建议二舅拍视频做木工,29天前发布
14785,莫听穿林打叶声，何妨吟啸且徐行。竹杖芒鞋轻胜马，谁怕,29天前发布
14786,平凡人不平凡的一生。,29天前发布
14787,吾辈楷模,29天前发布
14788,up描述的二舅的故事让我想起了小时候看的某篇文章，准确的说是某几篇文章，那时候还有热爱阅读的习惯，现在却浮躁得看不进一点书了。,29天前发布
14789,11万＋在看[OK],29天前发布
14790,一代人有一代人的长征  每个人都有自己的长征,29天前发布
14791,引流之主[doge],29天前发布
14792,面对困难时你可以选择怨天尤人，也可以选择勇敢面对,29天前发布
14793,"二舅的天资本身就已经超越了大多数人，而且二舅容易满足，没有那么多过高的期望

很多人的问题是在于，一方面认不清当前的水平和条件，一方面又有很高的期望，所以陷在二者之间的差距里挣扎

但是二舅没有这个问题，他天资高，又没有很高的期望，所以很容易达到自我满足的圆满状态，即便生理上百般痛苦折磨，但是精神上是满足的",29天前发布
14794,真好,29天前发布
14795,他公平。,29天前发布
14796,up主的文案让我理解了，文字是让人醒的，而不是醉的,29天前发布
14797,讲故事,29天前发布
14798,敬二舅,29天前发布
14799,人生最大的遗憾，就是遗憾过去的遗憾,29天前发布
14800,没有人发现不一点不对劲吗,29天前发布
14801,慕名而来,29天前发布
14802,天地不仁，以万物为刍狗,29天前发布
14803,智能手机的问题需要求解10岁的孩子,29天前发布
14804,敬二舅,29天前发布
14805,我喜欢这个故事，会有很多人需要这个故事的，感谢分享。。,29天前发布
14806,很多人就是忙忙碌碌的过完了一声,29天前发布
14807,他是我们的二舅,29天前发布
14808,这个视频给我推了好几次，我一直以为就是普通的宣传一些什么道教之类的。很感谢，还是推给我。,29天前发布
14809,想哭  敬二舅,29天前发布
14810,这世界上第一快乐的人，是不需要对别人负责的人，第二快乐的人就是从不回头看的人，人往往是快死的时候才发现人生最大的遗憾，就是一直在遗憾过去的遗憾，遗憾在电影里是主角崛起的前戏，生活里是让人沉沦的毒药。,29天前发布
14811,看完真的很震撼，人生真理：第二快乐的人是从不回头看的人！,29天前发布
14812,等一个“大家好我是二舅，今天入驻B站啦(*°▽°*)八(*°▽°*)?”,29天前发布
14813,11万+在看,29天前发布
14814,不知道是文案还是故事本身，在说起“本应该”的时候突然就哭了。是啊，本应该闲云野鹤生活富足，但怎么这样了呢？幸好，幸好二舅是具体的人，他在做自己的事。,29天前发布
14815,平凡而又伟大的，不屈的灵魂,29天前发布
14816,值得反复咀嚼,29天前发布
14817,非常优质的视频，非常感谢。但是说实话，无法对大部分的人起到任何的内在或者外在的帮助，大家的成长背景不同，面临的环境不同，认知方式不同，利益考量不同，因此并不具备治好精神内耗的功能。（不影响视频的内容和表达非常优秀,29天前发布
14818,"我叹他命不公，我惊他人自强，我爱他乐善美，我悲他伯乐无。
谢谢up主，在这个内外混乱，情感交杂的年代，治好了我的精神内耗。
敬二舅。",29天前发布
14819,不打扰，或许也是尊敬二舅的一种方式吧。,29天前发布
14820,看到有人说这是歌颂苦难，我实不敢苟同。我只看到二舅的生命之花接收着生命中的阳光顽强的绽放在山石的裂隙之间。勇敢的人不会因为掉了一片叶子就放弃盛开，也永远不会丢掉向上的力量！,29天前发布
14821,上热搜了,29天前发布
14822,"我发布了一篇笔记，快来看看吧
故人故事，无疾而终 中国人老说生老病死，生死之间何苦还要隔上个老病呢？这可不是上天的不仁，而是怜悯。不然我们每个人都在七八十岁，却还康健力壮之年去世，那对...
https://www.bilibili.com/h5/note-app/view?cvid=17776244&amp;pagefrom=comment",29天前发布
14823,"自强不息的平凡人，是我们这个国家最大的财富！我们国家能取得今天这样骄傲的成绩，是一代代的普通人共同缔造的！
致敬二舅，致敬像二舅一样自强不息的普通人！[点赞]",29天前发布
14824,提前祝明年最酷天团6789身体安康[打call][打call][打call][打call]一直健康到晋升6位数组合,29天前发布
14825,评论大多处于居高临下的俯视，得出很多幽默诙谐高度提炼的语句，但是 仔细想想  ，这样的一生落在自己身上，何其无助，何等可怕，那么问题来了，怪谁呢,29天前发布
14826,写得太好了,29天前发布
14827,二舅的兄弟姐妹没有义务抚养姥姥的义务吗？,29天前发布
14828,看完我的精神内耗更严重了，因为我深知我永远不会成为二舅那样的人，甚至以之为目标都很难做到,29天前发布
14829,致敬，现代达芬奇,29天前发布
14830,是二舅平凡而伟大的一生，身处困境，活出自我！,29天前发布
14831,接受命运中任何事情的发生,29天前发布
14832,敬二舅,29天前发布
14833,有种黑色幽默在里面,29天前发布
14834,看完很不舒服，并没有感动，不知为何,29天前发布
14835,平凡的世界,29天前发布
14836,我这种人，是不配评价这个视频的,29天前发布
14837,希望二舅身体健康，长命百岁,29天前发布
14838,令我敬佩的,29天前发布
14839,令我敬佩的,29天前发布
14840,好家伙，我关注up时粉丝可能就三十来万五十来万，这个视频刚发那会九十来万，现在直接干到一百多万，好家伙[笑哭]up牛牛牛！[给心心],29天前发布
14841,有人或许会觉得视频很长，没有耐心看完，但是这11分钟，讲完了二舅的大半辈子,29天前发布
14842,每一句都值得摘抄,29天前发布
14843,一个小视频，就能看到PU主的才华。一个感人又积极向上的真实故事，拍成电影我肯定去看[呲牙],29天前发布
14844,致敬,29天前发布
14845,“他这种奇才啊，只不过是生不逢时，他应该受国家的栽培，名扬天下才对，不应该弄到这么落魄可怜。”,29天前发布
14846,平淡的叙述幽默的文字，但是全程看的好想哭[保卫萝卜_哭哭],29天前发布
14847,敬二舅,29天前发布
14848,“这一生只愿只要平凡快乐 谁说这样不伟大呢”,29天前发布
14849,唉 生不逢时,29天前发布
14850,人生总是有遗憾的，幸好我也同二舅一样早就明白这个道理了[OK],29天前发布
14851,这不就是虚无主义吗,29天前发布
14852,坚韧是中国人的灵魂,29天前发布
14853,简单想了一下，以回答有些人说，人们现在这样为了金钱而生活，这是西化的后果，这是时代发展的后果。我觉得 有没有一种可能，以前不是不追求，而是没资格去追求，何不提起更早以前，人们双手还没解放的时候，那时也不存在阶级差距，人们缓慢的生活，现在也有人追求质朴，追求简单，但有两种方式，截然不同，一种是物质饱足后，一种是受限于物质，也许还有第三种，就是自己无论如何也想去，但这种人很少吧，何必提是西化的问题，古时多少人隐居山林不也为了引得注意求取功名，只能说何时没有，人各有志罢了,29天前发布
14854,“我们爱这个歪子，我们离不开这个歪子。”,29天前发布
14855,平凡而伟大,29天前发布
14856,敬二舅,29天前发布
14857,多说无言 敬二舅！看哭好几次了[大哭][大哭],29天前发布
14858,谁说站在光里的才是英雄！,29天前发布
14859,活在当下，随遇而安[打call],29天前发布
14860,二舅治好你的精神内耗，可能仅限于回村的那几天。当你回到城市，焦虑还会回来，内耗还会继续。二舅有二舅的时代，你有你的时代。任何通过“比惨”而获得的自我安慰，都不会真正减轻你的痛苦，因为你的痛苦就没有被正视、尊重过。,29天前发布
14861,真的很好诠释了什么叫做中华民族的坚韧。这么好的故事和文笔，都可以进中学教材了,29天前发布
14862,"中国人老说生老病死，生死之间何苦还要隔上个老病呢？这可不是上天的不仁，而是怜悯，不然我们每个人都在七八十岁却还康建力壮之年去世，那对这个世界该有多么的留恋呢？从这个意义上来讲老病是生死间的必要演习。

这段话总算是对我年迈多病的奶奶给出了最好的安慰。",29天前发布
14863,你们马上联系杭州凤起潮鸣豪宅美男雨辰,29天前发布
14864,人之所以痛苦，在于追求错误的东西。,29天前发布
14865,能把命运按在地上摩擦的神人，可敬,29天前发布
14866,人生无常，敢于面对生活的才是勇者。,29天前发布
14867,这世界上最不缺的就是遗憾，总是回头看的人满身都是遗憾，一直向前走的人想让自己忘掉那些遗憾，我们的一生，都在试图让自己与遗憾和解。,29天前发布
14868,敬二舅[大哭],29天前发布
14869,看看就能把木匠学会了，脑子真是好用。,29天前发布
14870,我会努力生活,29天前发布
14871,平凡铸就伟大，英雄来自人民[水稻],29天前发布
14872,中国人的究极浪漫——逍遥,29天前发布
14873,心态乐观的人是快乐的,29天前发布
14874,你二舅还是你二舅,29天前发布
14875,《钢的琴》,29天前发布
14876,真的是看了之后会在内心不息自动回放的视频，这素材，这文笔，还有这样一个天分极高、心态极好的人物，变成任何文艺作品都一定升格为精品。对于二舅，每个人都应该采用仰视的角度，为他如此生生不息前进的力量和智慧而钦佩，并突破与他相比自己身上无穷的局限性。,29天前发布
14877,二舅做了一辈子木匠，十根手指都还在，光这点就能看出二舅不是一般人[支持],29天前发布
14878,我会努力成为二舅一样平凡而坚强的人,29天前发布
14879,来二舅这里吸个氧[响指],29天前发布
14880,我希望能有二舅的平凡，致敬二舅，二舅让我不再迷茫,29天前发布
14881,这年头难见的高质量视频,29天前发布
14882,天啊，作者的文笔真好！,29天前发布
14883,我没有文化，二舅牛逼！文案牛逼！,29天前发布
14884,这是一部纪录片,29天前发布
14885,2000万冲刺！,29天前发布
14886,平凡的人，走出了平凡又不平凡的路,29天前发布
14887,慕名而来[口罩],29天前发布
14888,现实往往比电影更魔幻！,29天前发布
14889,无所不能的二舅,29天前发布
14890,哭久了，哭累了，哭笑了！,29天前发布
14891,致敬,29天前发布
14892,非常感谢，做错一些事情，已经成为定局的，已然变成了遗憾，但是不能一直对之前的遗憾耿耿于怀，需要做的是对未来不断的进行打磨，使自己之前所做错的事情变成自己不同于别人的长处。古语有云:吃一堑，长一智。犯错误是每个人成长必经的过程，但是能有所收获才是真正重要的。,29天前发布
14893,编进中小学教材吧，全文背诵的那种,29天前发布
14894,共情感动之后都别装！假如人生能够自由选择，请问又有多少人愿意去经历二舅那样的人生？,29天前发布
14895,二舅中年的三十年都乏善可陈，何况我们这些真正的普通人,29天前发布
14896,第一个一键三连送给二舅[支持],29天前发布
14897,第一次看到投币比点赞多的[哦呼],29天前发布
14898,当代年轻人的榜样[支持],29天前发布
14899,其实我家里也有一位这样的天才，从省重点高中陨落，但是她是落下了精神的疾病，十几年来这种巨大的心理落差被冲刷淡了。但是于我妹妹而言呢？午夜梦回的时候她回不回后悔当时那一场糊涂的禁忌之恋断送了自己一生的前程。时过境迁，我能做的就是继续为家里人奋斗，用一生无子的人生去弥补原生家庭的创伤！,29天前发布
14900,"第二遍看，弹幕出现了很多不和谐的声音[热]
大概是在酸播放量吧",29天前发布
14901,所以说  平淡也可以不平凡。,29天前发布
14902,这样真实来源平凡生活，又不平凡的一生，直击灵魂，二舅身上民族精神值得敬畏，反思当下物欲纵横，生活信念平淡无奇，精神层面需要充实太多太多,29天前发布
14903,加油,29天前发布
14904,我想继续活下去,29天前发布
14905,[大哭][大哭][大哭],29天前发布
14906,他公平。想念他了。,29天前发布
14907,恨自己没有华丽的语言去夸赞，只能说一句nb,29天前发布
14908,镇站之宝预定[热词系列_排面],29天前发布
14909,痛苦绝望的开始确被二舅化为励志不屈的一生，聪明绝顶的二舅目标很明确,29天前发布
14910,好多都是天意,29天前发布
14911,多年以后，在面对自己人生的最后时刻，二舅将会回想起村医来给他打针的那个遥远的下午。,29天前发布
14912,10w+,29天前发布
14913,“人生最大的遗憾是一直在过去的遗憾”过去的就让它过去吧，向前看.......真的这句话我真的哭死,29天前发布
14914,看哭了[大哭],29天前发布
14915,我们所经历的每一个日常，也许就是接连不断的奇迹！,29天前发布
14916,命若琴弦,29天前发布
14917,二舅平凡吗？二舅不平凡！二舅平凡吗？二舅平凡。,29天前发布
14918,惭愧，如果设身处地，我大概会是那个忘打开插线板开关的老头，而不是木工一看就会的二舅。,29天前发布
14919,惭愧，如果设身处地，我大概会是那个忘打开插线板开关的老头，而不是木工一看就会的二舅。,29天前发布
14920,致敬,29天前发布
14921,唉，本来是多么辉煌的一生啊,29天前发布
14922,特别喜欢里面一句话：父母的言传和身教最重要。因为小孩是小而不是瞎。,29天前发布
14923,致敬,29天前发布
14924,含泪看完，我的二舅远去好久了,29天前发布
14925,"“人生最大的遗憾 就是一直在遗憾过去的遗憾”
所以！请不要再回头看啦！！！",29天前发布
